id,title ,image_link ,country ,years ,director_description,leader,star ,description,tags,
215,牯岭街少年杀人事件,https://img9.doubanio.com/view/photo/s_ratio_poster/public/p848381236.jpg,中国台湾,1991, 杨德昌 Edward Yang, 张震 Chen Chang,8.9,弱者送给弱者的一刀。,剧情/犯罪,
216,源代码,https://img9.doubanio.com/view/photo/s_ratio_poster/public/p988260245.jpg,美国 加拿大,2011, 邓肯·琼斯 Duncan Jones, 杰克·吉伦哈尔 Jake Gyllenhaal,8.5,邓肯·琼斯继《月球》之后再度奉献出一部精彩绝伦的科幻佳作。,科幻/悬疑/惊悚,
217,新龙门客栈,https://img1.doubanio.com/view/photo/s_ratio_poster/public/p1421018669.jpg,中国香港 中国大陆,1992, 李惠民 Raymond Lee, 张曼玉 Maggie Cheung,8.6,嬉笑怒骂，调风动月。,动作/爱情/武侠/古装,
218,青蛇,https://img2.doubanio.com/view/photo/s_ratio_poster/public/p2570901292.jpg,中国香港 中国大陆,1993, 徐克 Hark Tsui, 张曼玉 Maggie Cheung,8.6,人生如此，浮生如斯。谁人言，花彼岸，此生情长意短。谁都是不懂爱的罢了。,剧情/爱情/奇幻/古装,
219,疯狂的麦克斯4：狂暴之路,https://img2.doubanio.com/view/photo/s_ratio_poster/public/p2236181653.jpg,澳大利亚 南非 美国,2015, 乔治·米勒 George Miller, 汤姆·哈迪 Tom Hardy,8.6,“多么美好的一天！”轰轰轰砰咚，啪哒哒哒轰隆隆，磅~,动作/科幻/冒险,
220,无耻混蛋,https://img1.doubanio.com/view/photo/s_ratio_poster/public/p2575043939.jpg,德国 美国,2009, Quentin Tarantino, 布拉德·皮特 Brad Pitt,8.6,昆汀同学越来越变态了，比北野武还杜琪峰。,剧情/犯罪,
221,血钻,https://img2.doubanio.com/view/photo/s_ratio_poster/public/p1244017073.jpg,美国 德国 英国,2006, 爱德华·兹威克 Edward Zwick, 莱昂纳多·迪卡普里奥 Leonardo ...,8.7,每个美丽事物背后都是滴血的现实。,剧情/惊悚/冒险,
222,燃情岁月,https://img1.doubanio.com/view/photo/s_ratio_poster/public/p1023654037.jpg,美国,1994, 爱德华·兹威克 Edward Zwick, 布拉德·皮特 Brad Pitt,8.8,传奇，不是每个人都可以拥有。,剧情/爱情/战争/西部,
223,步履不停,https://img1.doubanio.com/view/photo/s_ratio_poster/public/p2375245718.jpg,日本,2008, 是枝裕和 Hirokazu Koreeda, 阿部宽 Hiroshi Abe,8.8,日本的家庭电影已经是世界巅峰了，步履不停是巅峰中的佳作。,剧情/家庭,
224,海洋,https://img9.doubanio.com/view/photo/s_ratio_poster/public/p2559581324.jpg,法国 瑞士 西班牙 美国 阿联酋 摩纳哥,2009, 雅克·贝汉 Jacques Perrin, 雅克·贝汉 Jacques Perrin,9.1,大海啊，不全是水。,纪录片,
225,穿越时空的少女,https://img9.doubanio.com/view/photo/s_ratio_poster/public/p2079334286.jpg,日本,2006, 细田守 Mamoru Hosoda, 仲里依纱 Riisa Naka,8.6,爱上未来的你。 ,剧情/爱情/科幻/动画,
226,谍影重重2,https://img9.doubanio.com/view/photo/s_ratio_poster/public/p667644866.jpg,美国 德国,2004, 保罗·格林格拉斯 Paul Greengrass, 马特·达蒙 Matt Damon,8.7,谁说王家卫镜头很晃？,动作/悬疑/惊悚,
227,彗星来的那一夜,https://img9.doubanio.com/view/photo/s_ratio_poster/public/p2187896734.jpg,美国 英国,2013, 詹姆斯·沃德·布柯特 James Ward Byrkit, 艾米丽·芭尔多尼 Em...,8.5,小成本大魅力。,科幻/悬疑/惊悚,
228,东京教父,https://img1.doubanio.com/view/photo/s_ratio_poster/public/p456703618.jpg,日本,2003, 今敏 Satoshi Kon, 江守彻 Toru Emori,9.0,,剧情/喜剧/动画,
229,阿飞正传,https://img2.doubanio.com/view/photo/s_ratio_poster/public/p2525770523.jpg,中国香港,1990, 王家卫 Kar Wai Wong, 张国荣 Leslie Cheung,8.5,王家卫是一种风格，张国荣是一个代表。,犯罪/剧情/爱情,
230,战争之王,https://img3.doubanio.com/view/photo/s_ratio_poster/public/p792282381.jpg,美国 法国,2005, 安德鲁·尼科尔 Andrew Niccol, 尼古拉斯·凯奇 Nicolas Cage,8.7,做一颗让别人需要你的棋子。,剧情/犯罪,
231,地球上的星星,https://img9.doubanio.com/view/photo/s_ratio_poster/public/p1973489335.jpg,印度,2007, 阿米尔·汗 Aamir Khan, 达席尔·萨法瑞 Darsheel Safary,8.9,天使保护事件始末。,剧情/儿童/家庭,
232,完美陌生人,https://img9.doubanio.com/view/photo/s_ratio_poster/public/p2522331945.jpg,意大利,2016, 保罗·格诺维瑟 Paolo Genovese, 马可·贾利尼 Marco Giallini ...,8.5,来啊，互相伤害啊！,剧情/喜剧,
233,无间道2,https://img3.doubanio.com/view/photo/s_ratio_poster/public/p958008320.jpg,中国香港,2003, 刘伟强, 刘伟强,8.6,,动作/犯罪/剧情/惊悚,
234,谍影重重,https://img3.doubanio.com/view/photo/s_ratio_poster/public/p1597183981.jpg,美国 德国 捷克,2002, 道格·里曼 Doug Liman, 马特·达蒙 Matt Damon,8.6,哗啦啦啦啦，天在下雨，哗啦啦啦啦，云在哭泣……找自己。,动作/悬疑/惊悚,
235,香水,https://img2.doubanio.com/view/photo/s_ratio_poster/public/p2571500223.jpg,德国 法国 西班牙 美国,2006, 汤姆·提克威 Tom Tykwer, 本·卫肖 Ben Whishaw,8.5,一个单凭体香达到高潮的男人。,剧情/犯罪/奇幻,
236,千钧一发,https://img9.doubanio.com/view/photo/s_ratio_poster/public/p2195672555.jpg,美国,1997, 安德鲁·尼科尔 Andrew Niccol, 伊桑·霍克 Ethan Hawke,8.8,一部能引人思考的科幻励志片。,剧情/科幻/惊悚,
237,东京物语,https://img9.doubanio.com/view/photo/s_ratio_poster/public/p1925331564.jpg,日本,1953, 小津安二郎 Yasujirô Ozu, 笠智众 Chishû Ryû,9.2,东京那么大，如果有一天走失了，恐怕一辈子不能再相见。,剧情/家庭,
238,黑客帝国2：重装上阵,https://img3.doubanio.com/view/photo/s_ratio_poster/public/p443461390.jpg,美国 澳大利亚,2003, Andy Wachowski, Andy Wachowski,8.6,一个精彩的世界观正在缓缓建立。,动作/科幻,
239,崖上的波妞,https://img1.doubanio.com/view/photo/s_ratio_poster/public/p2627847859.jpg,日本,2008, 宫崎骏 Hayao Miyazaki, 奈良柚莉爱 Yuria Nara,8.5,,动画/奇幻/冒险,
240,驴得水,https://img3.doubanio.com/view/photo/s_ratio_poster/public/p2393044761.jpg,中国大陆,2016, 周申 Shen Zhou, 周申 Shen Zhou,8.3,过去的如果就让它过去了，未来只会越来越糟！,剧情/喜剧,
241,再次出发之纽约遇见你,https://img2.doubanio.com/view/photo/s_ratio_poster/public/p2250287733.jpg,美国,2013, 约翰·卡尼 John Carney, 凯拉·奈特莉 Keira Knightley,8.6,爱我就给我看你的播放列表。,喜剧/爱情/音乐,
242,朗读者,https://img1.doubanio.com/view/photo/s_ratio_poster/public/p1140984198.jpg,美国 德国,2008, 史蒂芬·戴德利 Stephen Daldry, 凯特·温丝莱特 Kate Winslet ...,8.6,当爱情跨越年龄的界限，它似乎能变得更久远一点，成为一种责任，一种水到渠成的相濡以沫。 ,剧情/爱情,
243,我爱你,https://img1.doubanio.com/view/photo/s_ratio_poster/public/p1075591188.jpg,韩国,2011, 秋昌民 Chang-min Choo, 宋在河 Jae-ho Song,9.1,你要相信，这世上真的有爱存在，不管在什么年纪 ,剧情/爱情,
244,猜火车,https://img1.doubanio.com/view/photo/s_ratio_poster/public/p513567548.jpg,英国,1996, 丹尼·博伊尔 Danny Boyle, 伊万·麦克格雷格 Ewan McGregor,8.5,不可猜的青春迷笛。 ,剧情/犯罪,
245,聚焦,https://img1.doubanio.com/view/photo/s_ratio_poster/public/p2263822658.jpg,美国,2015, 托马斯·麦卡锡 Thomas McCarthy, 马克·鲁弗洛 Mark Ruffalo,8.8,新闻人的理性求真。,剧情/传记,
246,浪潮,https://img2.doubanio.com/view/photo/s_ratio_poster/public/p1344888983.jpg,德国,2008, 丹尼斯·甘塞尔 Dennis Gansel, 尤尔根·沃格尔 Jürgen Vogel ...,8.7,世界离独裁只有五天。,剧情/惊悚,
247,小萝莉的猴神大叔,https://img9.doubanio.com/view/photo/s_ratio_poster/public/p2510956726.jpg,印度,2015, 卡比尔·汗 Kabir Khan, 萨尔曼·汗 Salman Khan,8.4,宝莱坞的萝莉与大叔。,剧情/喜剧/动作,
248,追随,https://img3.doubanio.com/view/photo/s_ratio_poster/public/p2561545031.jpg,英国,1998, 克里斯托弗·诺兰 Christopher Nolan, 杰里米·西奥伯德 Jeremy...,8.9,诺兰的牛逼来源于内心散发出的恐惧。,犯罪/悬疑/惊悚,
249,网络谜踪,https://img1.doubanio.com/view/photo/s_ratio_poster/public/p2542848758.jpg,美国 俄罗斯,2018, 阿尼什·查甘蒂 Aneesh Chaganty, 约翰·赵 John Cho,8.6,,剧情/犯罪/悬疑/惊悚,
250,黑鹰坠落,https://img3.doubanio.com/view/photo/s_ratio_poster/public/p1910900710.jpg,美国 英国,2001, 雷德利·斯科特 Ridley Scott, 乔什·哈奈特 Josh Hartnett,8.7,还原真实而残酷的战争。,动作/历史/战争,
