id,title ,image_link ,country ,years ,director_description,leader,star ,description,tags,
1,肖申克的救赎,https://img2.doubanio.com/view/photo/s_ratio_poster/public/p480747492.jpg,美国,1994, 弗兰克·德拉邦特 Frank Darabont, 蒂姆·罗宾斯 Tim Robbins,9.7,希望让人自由。,犯罪/剧情,
2,霸王别姬,https://img3.doubanio.com/view/photo/s_ratio_poster/public/p2561716440.jpg,中国大陆 中国香港,1993, 陈凯歌 Kaige Chen, 张国荣 Leslie Cheung,9.6,风华绝代。,剧情/爱情/同性,
3,阿甘正传,https://img2.doubanio.com/view/photo/s_ratio_poster/public/p2372307693.jpg,美国,1994, 罗伯特·泽米吉斯 Robert Zemeckis, 汤姆·汉克斯 Tom Hanks,9.5,一部美国近现代史。,剧情/爱情,
4,这个杀手不太冷,https://img3.doubanio.com/view/photo/s_ratio_poster/public/p511118051.jpg,法国 美国,1994, 吕克·贝松 Luc Besson, 让·雷诺 Jean Reno,9.4,怪蜀黍和小萝莉不得不说的故事。,剧情/动作/犯罪,
5,泰坦尼克号,https://img9.doubanio.com/view/photo/s_ratio_poster/public/p457760035.jpg,美国 墨西哥 澳大利亚 加拿大,1997, 詹姆斯·卡梅隆 James Cameron, 莱昂纳多·迪卡普里奥 Leonardo...,9.4,失去的才是永恒的。 ,剧情/爱情/灾难,
6,美丽人生,https://img2.doubanio.com/view/photo/s_ratio_poster/public/p2578474613.jpg,意大利,1997, 罗伯托·贝尼尼 Roberto Benigni, 罗伯托·贝尼尼 Roberto Beni...,9.5,最美的谎言。,剧情/喜剧/爱情/战争,
7,千与千寻,https://img1.doubanio.com/view/photo/s_ratio_poster/public/p2557573348.jpg,日本,2001, 宫崎骏 Hayao Miyazaki, 柊瑠美 Rumi Hîragi,9.4,最好的宫崎骏，最好的久石让。 ,剧情/动画/奇幻,
8,辛德勒的名单,https://img2.doubanio.com/view/photo/s_ratio_poster/public/p492406163.jpg,美国,1993, 史蒂文·斯皮尔伯格 Steven Spielberg, 连姆·尼森 Liam Neeson...,9.5,拯救一个人，就是拯救整个世界。,剧情/历史/战争,
9,盗梦空间,https://img2.doubanio.com/view/photo/s_ratio_poster/public/p2616355133.jpg,美国 英国,2010, 克里斯托弗·诺兰 Christopher Nolan, 莱昂纳多·迪卡普里奥 Le...,9.3,诺兰给了我们一场无法盗取的梦。,剧情/科幻/悬疑/冒险,
10,忠犬八公的故事,https://img1.doubanio.com/view/photo/s_ratio_poster/public/p524964039.jpg,美国 英国,2009, 莱塞·霍尔斯道姆 Lasse Hallström, 理查·基尔 Richard Ger...,9.4,永远都不能忘记你所爱的人。,剧情,
11,星际穿越,https://img1.doubanio.com/view/photo/s_ratio_poster/public/p2614988097.jpg,美国 英国 加拿大,2014, 克里斯托弗·诺兰 Christopher Nolan, 马修·麦康纳 Matthew Mc...,9.3,爱是一种力量，让我们超越时空感知它的存在。,剧情/科幻/冒险,
12,楚门的世界,https://img2.doubanio.com/view/photo/s_ratio_poster/public/p479682972.jpg,美国,1998, 彼得·威尔 Peter Weir, 金·凯瑞 Jim Carrey,9.3,如果再也不能见到你，祝你早安，午安，晚安。,剧情/科幻,
13,海上钢琴师,https://img9.doubanio.com/view/photo/s_ratio_poster/public/p2574551676.jpg,意大利,1998, 朱塞佩·托纳多雷 Giuseppe Tornatore, 蒂姆·罗斯 Tim Roth,9.3,每个人都要走一条自己坚定了的路，就算是粉身碎骨。 ,剧情/音乐,
14,三傻大闹宝莱坞,https://img3.doubanio.com/view/photo/s_ratio_poster/public/p579729551.jpg,印度,2009, 拉库马·希拉尼 Rajkumar Hirani, 阿米尔·汗 Aamir Khan,9.2,英俊版憨豆，高情商版谢耳朵。,剧情/喜剧/爱情/歌舞,
15,机器人总动员,https://img3.doubanio.com/view/photo/s_ratio_poster/public/p1461851991.jpg,美国,2008, 安德鲁·斯坦顿 Andrew Stanton, 本·贝尔特 Ben Burtt,9.3,小瓦力，大人生。,科幻/动画/冒险,
16,放牛班的春天,https://img3.doubanio.com/view/photo/s_ratio_poster/public/p1910824951.jpg,法国 瑞士 德国,2004, 克里斯托夫·巴拉蒂 Christophe Barratier, 热拉尔·朱尼奥 Gé...,9.3,天籁一般的童声，是最接近上帝的存在。 ,剧情/喜剧/音乐,
17,大话西游之大圣娶亲,https://img9.doubanio.com/view/photo/s_ratio_poster/public/p2455050536.jpg,中国香港 中国大陆,1995, 刘镇伟 Jeffrey Lau, 周星驰 Stephen Chow,9.2,一生所爱。,喜剧/爱情/奇幻/古装,
18,疯狂动物城,https://img1.doubanio.com/view/photo/s_ratio_poster/public/p2614500649.jpg,美国,2016, 拜伦·霍华德 Byron Howard, 拜伦·霍华德 Byron Howard,9.2,迪士尼给我们营造的乌托邦就是这样，永远善良勇敢，永远出乎意料。,喜剧/动画/冒险,
19,无间道,https://img2.doubanio.com/view/photo/s_ratio_poster/public/p2564556863.jpg,中国香港,2002, 刘伟强, 刘伟强,9.2,香港电影史上永不过时的杰作。,剧情/犯罪/悬疑,
20,熔炉,https://img9.doubanio.com/view/photo/s_ratio_poster/public/p1363250216.jpg,韩国,2011, 黄东赫 Dong-hyuk Hwang, 孔侑 Yoo Gong,9.3,我们一路奋战不是为了改变世界，而是为了不让世界改变我们。,剧情,
21,教父,https://img9.doubanio.com/view/photo/s_ratio_poster/public/p616779645.jpg,美国,1972, 弗朗西斯·福特·科波拉 Francis Ford Coppola, 马龙·白兰度 M...,9.3,千万不要记恨你的对手，这样会让你失去理智。,剧情/犯罪,
22,当幸福来敲门,https://img9.doubanio.com/view/photo/s_ratio_poster/public/p2614359276.jpg,美国,2006, 加布里尔·穆奇诺 Gabriele Muccino, 威尔·史密斯 Will Smith ...,9.1,平民励志片。 ,剧情/传记/家庭,
23,龙猫,https://img9.doubanio.com/view/photo/s_ratio_poster/public/p2540924496.jpg,日本,1988, 宫崎骏 Hayao Miyazaki, 日高法子 Noriko Hidaka,9.2,人人心中都有个龙猫，童年就永远不会消失。,动画/奇幻/冒险,
24,怦然心动,https://img1.doubanio.com/view/photo/s_ratio_poster/public/p501177648.jpg,美国,2010, 罗伯·莱纳 Rob Reiner, 玛德琳·卡罗尔 Madeline Carroll,9.1,真正的幸福是来自内心深处。,剧情/喜剧/爱情,
25,控方证人,https://img1.doubanio.com/view/photo/s_ratio_poster/public/p1505392928.jpg,美国,1957, 比利·怀尔德 Billy Wilder, 泰隆·鲍华 Tyrone Power,9.6,比利·怀德满分作品。,剧情/犯罪/悬疑,
26,触不可及,https://img9.doubanio.com/view/photo/s_ratio_poster/public/p1454261925.jpg,法国,2011, 奥利维·那卡什 Olivier Nakache, 奥利维·那卡什 Olivier Nakache,9.3,满满温情的高雅喜剧。,剧情/喜剧,
27,蝙蝠侠：黑暗骑士,https://img2.doubanio.com/view/photo/s_ratio_poster/public/p462657443.jpg,美国 英国,2008, 克里斯托弗·诺兰 Christopher Nolan, 克里斯蒂安·贝尔 Christ...,9.2,无尽的黑暗。,剧情/动作/科幻/犯罪/惊悚,
28,末代皇帝,https://img2.doubanio.com/view/photo/s_ratio_poster/public/p452089833.jpg,英国 意大利 中国大陆 法国,1987, 贝纳尔多·贝托鲁奇 Bernardo Bertolucci, 尊龙 John Lone,9.3,“不要跟我比惨，我比你更惨”再适合这部电影不过了。,剧情/传记/历史,
29,寻梦环游记,https://img9.doubanio.com/view/photo/s_ratio_poster/public/p2614500706.jpg,美国,2017, 李·昂克里奇 Lee Unkrich, 李·昂克里奇 Lee Unkrich,9.1,死亡不是真的逝去，遗忘才是永恒的消亡。,喜剧/动画/奇幻/音乐,
30,活着,https://img2.doubanio.com/view/photo/s_ratio_poster/public/p2524040532.jpg,中国大陆 中国香港,1994, 张艺谋 Yimou Zhang, 葛优 You Ge,9.3,张艺谋最好的电影。,剧情/历史/家庭,
31,何以为家,https://img1.doubanio.com/view/photo/s_ratio_poster/public/p2555295759.jpg,黎巴嫩 美国 法国 塞浦路斯 卡塔尔 英国,2018, 娜丁·拉巴基 Nadine Labaki, 扎因·拉费阿 Zain al-Rafeea,9.1,凝视卑弱生命，用电影改变命运。,剧情,
32,乱世佳人,https://img3.doubanio.com/view/photo/s_ratio_poster/public/p1963126880.jpg,美国,1939, 维克多·弗莱明 Victor Fleming, 维克多·弗莱明 Victor Fleming,9.3,Tomorrow is another day.,剧情/历史/爱情/战争,
33,哈利·波特与魔法石,https://img9.doubanio.com/view/photo/s_ratio_poster/public/p2614949805.jpg,美国 英国,2001, Chris Columbus, Daniel Radcliffe,9.1,童话世界的开端。,奇幻/冒险,
34,指环王3：王者无敌,https://img2.doubanio.com/view/photo/s_ratio_poster/public/p691932373.jpg,美国 新西兰,2003, 彼得·杰克逊 Peter Jackson, 伊利亚·伍德 Elijah Wood,9.2,史诗的终章。,剧情/动作/奇幻/冒险,
35,飞屋环游记,https://img9.doubanio.com/view/photo/s_ratio_poster/public/p485887754.jpg,美国,2009, 彼特·道格特 Pete Docter, 彼特·道格特 Pete Docter,9.0,最后那些最无聊的事情，才是最值得怀念的。 ,剧情/喜剧/动画/冒险,
36,摔跤吧！爸爸,https://img1.doubanio.com/view/photo/s_ratio_poster/public/p2401676338.jpg,印度,2016, 涅提·蒂瓦里 Nitesh Tiwari, 阿米尔·汗 Aamir Khan,9.0,你不是在为你一个人战斗，你要让千千万万的女性看到女生并不是只能相夫教子。,剧情/传记/运动/家庭,
37,素媛,https://img9.doubanio.com/view/photo/s_ratio_poster/public/p2118532944.jpg,韩国,2013, 李濬益 Jun-ik Lee, 薛景求 Kyung-gu Sol,9.3,受过伤害的人总是笑得最开心，因为他们不愿意让身边的人承受一样的痛苦。,剧情,
38,少年派的奇幻漂流,https://img3.doubanio.com/view/photo/s_ratio_poster/public/p1784592701.jpg,美国 中国台湾 英国 加拿大,2012, 李安 Ang Lee, 苏拉·沙玛 Suraj Sharma,9.1,瑰丽壮观、无人能及的冒险之旅。,剧情/奇幻/冒险,
39,十二怒汉,https://img2.doubanio.com/view/photo/s_ratio_poster/public/p2173577632.jpg,美国,1957, Sidney Lumet, 亨利·方达 Henry Fonda,9.4,1957年的理想主义。 ,剧情,
40,哈尔的移动城堡,https://img3.doubanio.com/view/photo/s_ratio_poster/public/p2174346180.jpg,日本,2004, 宫崎骏 Hayao Miyazaki, 倍赏千惠子 Chieko Baishô,9.1,带着心爱的人在天空飞翔。,动画/奇幻/冒险,
41,鬼子来了,https://img1.doubanio.com/view/photo/s_ratio_poster/public/p2553104888.jpg,中国大陆,2000, 姜文 Wen Jiang, 姜文 Wen Jiang,9.3,对敌人的仁慈，就是对自己残忍。,剧情/喜剧,
42,我不是药神,https://img9.doubanio.com/view/photo/s_ratio_poster/public/p2561305376.jpg,中国大陆,2018, 文牧野 Muye Wen, 徐峥 Zheng Xu,9.0,对我们国家而言，这样的电影多一部是一部。,剧情/喜剧,
43,大话西游之月光宝盒,https://img2.doubanio.com/view/photo/s_ratio_poster/public/p2561721372.jpg,中国香港 中国大陆,1995, 刘镇伟 Jeffrey Lau, 周星驰 Stephen Chow,9.0,旷古烁今。,喜剧/爱情/奇幻/古装,
44,天空之城,https://img1.doubanio.com/view/photo/s_ratio_poster/public/p1446261379.jpg,日本,1986, 宫崎骏 Hayao Miyazaki, 田中真弓 Mayumi Tanaka,9.1,对天空的追逐，永不停止。 ,动画/奇幻/冒险,
45,罗马假日,https://img9.doubanio.com/view/photo/s_ratio_poster/public/p2189265085.jpg,美国,1953, 威廉·惠勒 William Wyler, 奥黛丽·赫本 Audrey Hepburn,9.0,爱情哪怕只有一天。,喜剧/剧情/爱情,
46,闻香识女人,https://img1.doubanio.com/view/photo/s_ratio_poster/public/p2550757929.jpg,美国,1992, 马丁·布莱斯 Martin Brest, 阿尔·帕西诺 Al Pacino,9.1,史上最美的探戈。,剧情,
47,辩护人,https://img9.doubanio.com/view/photo/s_ratio_poster/public/p2158166535.jpg,韩国,2013, 杨宇硕 Woo-seok Yang, 宋康昊 Kang-ho Song,9.2,电影的现实意义大过电影本身。,剧情,
48,天堂电影院,https://img1.doubanio.com/view/photo/s_ratio_poster/public/p2559577569.jpg,意大利 法国,1988, 朱塞佩·托纳多雷 Giuseppe Tornatore, 菲利普·努瓦雷 Philipp...,9.2,那些吻戏，那些青春，都在影院的黑暗里被泪水冲刷得无比清晰。,剧情/爱情,
49,猫鼠游戏,https://img3.doubanio.com/view/photo/s_ratio_poster/public/p453924541.jpg,美国 加拿大,2002, 史蒂文·斯皮尔伯格 Steven Spielberg, 莱昂纳多·迪卡普里奥 L...,9.0,骗子大师和执著警探的你追我跑故事。 ,传记/犯罪/剧情,
50,大闹天宫,https://img1.doubanio.com/view/photo/s_ratio_poster/public/p2184505167.jpg,1964(中国大陆),1961(中国大陆), 万籁鸣 Laiming Wan, 万籁鸣 Laiming Wan,9.4,经典之作，历久弥新。,动画/奇幻,
51,钢琴家,https://img2.doubanio.com/view/photo/s_ratio_poster/public/p792376093.jpg,英国 法国 波兰 德国 美国,2002, 罗曼·波兰斯基 Roman Polanski, 艾德里安·布洛迪 Adrien Brod...,9.2,音乐能化解仇恨。,剧情/传记/战争/音乐,
52,指环王2：双塔奇兵,https://img9.doubanio.com/view/photo/s_ratio_poster/public/p2640236255.jpg,美国 新西兰,2002, 彼得·杰克逊 Peter Jackson, 伊利亚·伍德 Elijah Wood,9.1,承前启后的史诗篇章。,剧情/动作/奇幻/冒险,
53,教父2,https://img1.doubanio.com/view/photo/s_ratio_poster/public/p2194138787.jpg,美国,1974, 弗朗西斯·福特·科波拉 Francis Ford Coppola, 阿尔·帕西诺 A...,9.2,优雅的孤独。,剧情/犯罪,
54,狮子王,https://img1.doubanio.com/view/photo/s_ratio_poster/public/p2277799019.jpg,美国,1994, Roger Allers, Roger Allers,9.0,动物版《哈姆雷特》。,动画/冒险/歌舞,
55,搏击俱乐部,https://img1.doubanio.com/view/photo/s_ratio_poster/public/p1910926158.jpg,美国 德国 意大利,1999, 大卫·芬奇 David Fincher, 爱德华·诺顿 Edward Norton,9.0,邪恶与平庸蛰伏于同一个母体，在特定的时间互相对峙。,剧情/动作/悬疑/惊悚,
56,死亡诗社,https://img3.doubanio.com/view/photo/s_ratio_poster/public/p2575465690.jpg,美国,1989, 彼得·威尔 Peter Weir, 罗宾·威廉姆斯 Robin Williams,9.1,当一个死水般的体制内出现一个活跃的变数时，所有的腐臭都站在了光明的对面。,剧情,
57,黑客帝国,https://img1.doubanio.com/view/photo/s_ratio_poster/public/p451926968.jpg,美国 澳大利亚,1999, 安迪·沃卓斯基 Andy Wachowski, 安迪·沃卓斯基 Andy Wachowski,9.0,视觉革命。,动作/科幻,
58,指环王1：护戒使者,https://img3.doubanio.com/view/photo/s_ratio_poster/public/p2640234840.jpg,新西兰 美国,2001, 彼得·杰克逊 Peter Jackson, 伊利亚·伍德 Elijah Wood,9.0,传说的开始。,剧情/动作/奇幻/冒险,
59,让子弹飞,https://img1.doubanio.com/view/photo/s_ratio_poster/public/p1512562287.jpg,中国大陆 中国香港,2010, 姜文 Wen Jiang, 姜文 Wen Jiang,8.9,你给我翻译翻译，神马叫做TMD的惊喜。,剧情/喜剧/动作/西部,
60,绿皮书,https://img2.doubanio.com/view/photo/s_ratio_poster/public/p2549177902.jpg,美国 中国大陆,2018, 彼得·法雷里 Peter Farrelly, 维果·莫腾森 Viggo Mortensen,8.9,去除成见，需要勇气。,剧情/喜剧/传记,
61,饮食男女,https://img3.doubanio.com/view/photo/s_ratio_poster/public/p1910899751.jpg,中国台湾 美国,1994, 李安 Ang Lee, 郎雄 Sihung Lung,9.1,人生不能像做菜，把所有的料都准备好了才下锅。,剧情/家庭,
62,美丽心灵,https://img3.doubanio.com/view/photo/s_ratio_poster/public/p1665997400.jpg,美国,2001, 朗·霍华德 Ron Howard, 罗素·克劳 Russell Crowe,9.0,爱是一切逻辑和原由。,传记/剧情,
63,窃听风暴,https://img1.doubanio.com/view/photo/s_ratio_poster/public/p1808872109.jpg,德国,2006, 弗洛里安·亨克尔·冯·多纳斯马尔克 Florian Henckel von Donnersmarck,,9.2,别样人生。,剧情/悬疑,
64,海蒂和爷爷,https://img9.doubanio.com/view/photo/s_ratio_poster/public/p2554525534.jpg,德国 瑞士,2015, 阿兰·葛斯彭纳 Alain Gsponer, 阿努克·斯特芬 Anuk Steffen,9.2,如果生活中有什么使你感到快乐，那就去做吧！不要管别人说什么。,剧情/冒险/家庭,
65,两杆大烟枪,https://img1.doubanio.com/view/photo/s_ratio_poster/public/p792443418.jpg,英国,1998, Guy Ritchie, Jason Flemyng,9.1,4个臭皮匠顶个诸葛亮，盖·里奇果然不是盖的。,剧情/喜剧/犯罪,
66,本杰明·巴顿奇事,https://img2.doubanio.com/view/photo/s_ratio_poster/public/p2192535722.jpg,美国,2008, 大卫·芬奇 David Fincher, 凯特·布兰切特 Cate Blanchett,8.9,在时间之河里感受溺水之苦。,剧情/爱情/奇幻,
67,看不见的客人,https://img9.doubanio.com/view/photo/s_ratio_poster/public/p2498971355.jpg,西班牙,2016, 奥里奥尔·保罗 Oriol Paulo, 马里奥·卡萨斯 Mario Casas,8.8,你以为你以为的就是你以为的。,剧情/犯罪/悬疑/惊悚,
68,飞越疯人院,https://img1.doubanio.com/view/photo/s_ratio_poster/public/p792238287.jpg,美国,1975, 米洛斯·福尔曼 Miloš Forman, 杰克·尼科尔森 Jack Nichols...,9.1,自由万岁。,剧情,
69,西西里的美丽传说,https://img1.doubanio.com/view/photo/s_ratio_poster/public/p2441988159.jpg,意大利 美国,2000, 朱塞佩·托纳多雷 Giuseppe Tornatore, 莫妮卡·贝鲁奇 Monica ...,8.9,美丽无罪。,剧情/战争/情色,
70,穿条纹睡衣的男孩,https://img2.doubanio.com/view/photo/s_ratio_poster/public/p1473670352.jpg,英国 美国,2008, 马克·赫尔曼 Mark Herman, 阿萨·巴特菲尔德 Asa Butterfield ...,9.1,尽管有些不切实际的幻想，这部电影依旧是一部感人肺腑的佳作。,剧情/战争,
71,拯救大兵瑞恩,https://img9.doubanio.com/view/photo/s_ratio_poster/public/p1014542496.jpg,美国,1998, 史蒂文·斯皮尔伯格 Steven Spielberg, 汤姆·汉克斯 Tom Hanks...,9.0,美利坚精神输出大片No1.,剧情/战争,
72,小鞋子,https://img9.doubanio.com/view/photo/s_ratio_poster/public/p2165511465.jpg,伊朗,1997, 马基德·马基迪 Majid Majidi, 法拉赫阿米尔·哈什米安 Amir Fa...,9.2,奔跑的孩子是天使。,剧情/儿童/家庭,
73,音乐之声,https://img1.doubanio.com/view/photo/s_ratio_poster/public/p453788577.jpg,美国,1965, 罗伯特·怀斯 Robert Wise, 朱莉·安德鲁斯 Julie Andrews,9.1,用音乐化解仇恨，让歌声串起美好。,剧情/传记/爱情/歌舞,
74,情书,https://img1.doubanio.com/view/photo/s_ratio_poster/public/p449897379.jpg,日本,1995, 岩井俊二 Shunji Iwai, 中山美穗 Miho Nakayama,8.9,暗恋的极致。,剧情/爱情,
75,海豚湾,https://img1.doubanio.com/view/photo/s_ratio_poster/public/p2559579779.jpg,美国,2009, 路易·西霍尤斯 Louie Psihoyos, Richard O'Barry,9.3,海豚的微笑，是世界上最高明的伪装。,纪录片,
76,阿凡达,https://img2.doubanio.com/view/photo/s_ratio_poster/public/p2634997853.jpg,美国,2009, 詹姆斯·卡梅隆 James Cameron, 萨姆·沃辛顿 Sam Worthington ...,8.8,绝对意义上的美轮美奂。,动作/科幻/冒险,
77,致命魔术,https://img9.doubanio.com/view/photo/s_ratio_poster/public/p480383375.jpg,英国 美国,2006, 克里斯托弗·诺兰 Christopher Nolan, 休·杰克曼 Hugh Jackman...,8.9,孪生蝙蝠侠大战克隆金刚狼。,剧情/悬疑/惊悚,
78,美国往事,https://img1.doubanio.com/view/photo/s_ratio_poster/public/p477229647.jpg,美国 意大利,1984, 赛尔乔·莱翁内 Sergio Leone, 罗伯特·德尼罗 Robert De Niro ...,9.2,往事如烟，无处祭奠。,犯罪/剧情,
79,沉默的羔羊,https://img1.doubanio.com/view/photo/s_ratio_poster/public/p1593414327.jpg,美国,1991, 乔纳森·戴米 Jonathan Demme, 朱迪·福斯特 Jodie Foster,8.9,安东尼·霍普金斯的顶级表演。,剧情/犯罪/惊悚,
80,禁闭岛,https://img1.doubanio.com/view/photo/s_ratio_poster/public/p1832875827.jpg,美国,2010, Martin Scorsese, 莱昂纳多·迪卡普里奥 Leonardo DiCaprio,8.8,昔日翩翩少年，今日大腹便便。,剧情/悬疑/惊悚,
81,低俗小说,https://img2.doubanio.com/view/photo/s_ratio_poster/public/p1910902213.jpg,美国,1994, 昆汀·塔伦蒂诺 Quentin Tarantino, 约翰·特拉沃尔塔 John Tra...,8.9,故事的高级讲法。,剧情/喜剧/犯罪,
82,蝴蝶效应,https://img1.doubanio.com/view/photo/s_ratio_poster/public/p2209066019.jpg,美国 加拿大,2004, 埃里克·布雷斯 Eric Bress, 埃里克·布雷斯 Eric Bress,8.8,人的命运被自己瞬间的抉择改变。,剧情/悬疑/科幻/惊悚,
83,心灵捕手,https://img9.doubanio.com/view/photo/s_ratio_poster/public/p480965695.jpg,美国,1997, 格斯·范·桑特 Gus Van Sant, 马特·达蒙 Matt Damon,8.9,人生中应该拥有这样的一段豁然开朗。,剧情,
84,布达佩斯大饭店,https://img2.doubanio.com/view/photo/s_ratio_poster/public/p2178872593.jpg,美国 德国 英国,2014, 韦斯·安德森 Wes Anderson, 拉尔夫·费因斯 Ralph Fiennes,8.9,小清新的故事里注入了大历史的情怀。,剧情/喜剧/冒险,
85,七宗罪,https://img9.doubanio.com/view/photo/s_ratio_poster/public/p2219586434.jpg,美国,1995, 大卫·芬奇 David Fincher, 摩根·弗里曼 Morgan Freeman,8.8,警察抓小偷，老鼠玩死猫。,剧情/犯罪/悬疑/惊悚,
86,春光乍泄,https://img3.doubanio.com/view/photo/s_ratio_poster/public/p465939041.jpg,中国香港 日本 韩国,1997, 王家卫 Kar Wai Wong, 张国荣 Leslie Cheung,8.9,爱情纠缠，男女一致。,剧情/爱情/同性,
87,哈利·波特与死亡圣器(下),https://img2.doubanio.com/view/photo/s_ratio_poster/public/p917846733.jpg,美国 英国,2011, 大卫·叶茨 David Yates, 丹尼尔·雷德克里夫 Daniel Radcliffe...,8.9,10年的完美句点。,奇幻/冒险,
88,摩登时代,https://img1.doubanio.com/view/photo/s_ratio_poster/public/p2263408369.jpg,美国,1936, 查理·卓别林 Charles Chaplin, 查理·卓别林 Charles Chaplin ...,9.3,大时代中的人生，小人物的悲喜。,剧情/喜剧/爱情,
89,被嫌弃的松子的一生,https://img9.doubanio.com/view/photo/s_ratio_poster/public/p884763596.jpg,日本,2006, 中岛哲也 Tetsuya Nakashima, 中谷美纪 Miki Nakatani,8.9,以戏谑来戏谑戏谑。,剧情/歌舞,
90,喜剧之王,https://img1.doubanio.com/view/photo/s_ratio_poster/public/p2579932167.jpg,中国香港,1999, 周星驰 Stephen Chow, 周星驰 Stephen Chow,8.8,我是一个演员。,喜剧/剧情/爱情,
91,致命ID,https://img9.doubanio.com/view/photo/s_ratio_poster/public/p2558364386.jpg,美国,2003, 詹姆斯·曼高德 James Mangold, 约翰·库萨克 John Cusack,8.8,最不可能的那个人永远是最可能的。,剧情/悬疑/惊悚,
92,杀人回忆,https://img3.doubanio.com/view/photo/s_ratio_poster/public/p657823840.jpg,韩国,2003, 奉俊昊 Joon-ho Bong, 宋康昊 Kang-ho Song,8.9,关于连环杀人悬案的集体回忆。,剧情/动作/犯罪/悬疑/惊悚,
93,剪刀手爱德华,https://img1.doubanio.com/view/photo/s_ratio_poster/public/p480956937.jpg,美国,1990, 蒂姆·波顿 Tim Burton, 约翰尼·德普 Johnny Depp,8.7,浪漫忧郁的成人童话。,剧情/奇幻/爱情,
94,加勒比海盗,https://img9.doubanio.com/view/photo/s_ratio_poster/public/p1596085504.jpg,美国,2003, 戈尔·维宾斯基 Gore Verbinski, 约翰尼·德普 Johnny Depp,8.8,约翰尼·德普的独角戏。,动作/冒险/奇幻,
95,勇敢的心,https://img1.doubanio.com/view/photo/s_ratio_poster/public/p2004174709.jpg,美国,1995, 梅尔·吉布森 Mel Gibson, 梅尔·吉布森 Mel Gibson,8.9,史诗大片的典范。,动作/传记/剧情/历史/战争,
96,狩猎,https://img1.doubanio.com/view/photo/s_ratio_poster/public/p1546987967.jpg,丹麦 瑞典,2012, 托马斯·温特伯格 Thomas Vinterberg, 麦斯·米科尔森 Mads Mik...,9.1,人言可畏。,剧情,
97,请以你的名字呼唤我,https://img3.doubanio.com/view/photo/s_ratio_poster/public/p2505525050.jpg,意大利 法国 巴西 美国 荷兰 德国,2017, 卢卡·瓜达尼诺 Luca Guadagnino, 艾米·汉莫 Armie Hammer,8.9,沉醉在电影的情感和视听氛围中无法自拔。,剧情/爱情/同性,
98,红辣椒,https://img3.doubanio.com/view/photo/s_ratio_poster/public/p456825720.jpg,日本,2006, 今敏 Satoshi Kon, 林原惠美 Megumi Hayashibara,9.0,梦的勾结。,动画/悬疑/科幻/惊悚,
99,断背山,https://img1.doubanio.com/view/photo/s_ratio_poster/public/p2604889017.jpg,美国 加拿大,2005, 李安 Ang Lee, 希斯·莱杰 Heath Ledger,8.8,每个人心中都有一座断背山。,剧情/爱情/同性/家庭,
100,天使爱美丽,https://img2.doubanio.com/view/photo/s_ratio_poster/public/p2447590313.jpg,法国 德国,2001, 让-皮埃尔·热内 Jean-Pierre Jeunet, 奥黛丽·塔图 Audrey Tau...,8.7,法式小清新。 ,剧情/喜剧/爱情,
101,7号房的礼物,https://img9.doubanio.com/view/photo/s_ratio_poster/public/p1816276065.jpg,韩国,2013, 李焕庆 Hwan-kyeong Lee, 柳承龙 Seung-yong Ryoo,8.9,《我是山姆》的《美丽人生》。,剧情/喜剧/家庭,
102,幽灵公主,https://img9.doubanio.com/view/photo/s_ratio_poster/public/p1613191025.jpg,日本,1997, 宫崎骏 Hayao Miyazaki, 松田洋治 Yôji Matsuda,8.9,人与自然的战争史诗。,动画/奇幻/冒险,
103,小森林 夏秋篇,https://img2.doubanio.com/view/photo/s_ratio_poster/public/p2564498893.jpg,日本,2014, 森淳一 Junichi Mori, 桥本爱 Ai Hashimoto,9.0,那些静得只能听见呼吸的日子里，你明白孤独即生活。,剧情,
104,第六感,https://img9.doubanio.com/view/photo/s_ratio_poster/public/p2220184425.jpg,美国,1999, M·奈特·沙马兰 M. Night Shyamalan, 布鲁斯·威利斯 Bruce Wi...,8.9,深入内心的恐怖，出人意料的结局。,剧情/悬疑/惊悚,
105,阳光灿烂的日子,https://img9.doubanio.com/view/photo/s_ratio_poster/public/p2564685215.jpg,中国大陆 中国香港,1994, 姜文 Wen Jiang, 夏雨 Yu Xia,8.8,一场华丽的意淫。,剧情/爱情,
106,重庆森林,https://img3.doubanio.com/view/photo/s_ratio_poster/public/p792381411.jpg,中国香港,1994, 王家卫 Kar Wai Wong, 林青霞 Brigitte Lin,8.8,寂寞没有期限。,剧情/爱情,
107,唐伯虎点秋香,https://img9.doubanio.com/view/photo/s_ratio_poster/public/p2357915564.jpg,中国香港,1993, 李力持 Lik-Chi Lee, 周星驰 Stephen Chow,8.7,华太师是黄霑，吴镇宇四大才子之一。,喜剧/爱情/古装,
108,超脱,https://img3.doubanio.com/view/photo/s_ratio_poster/public/p1305562621.jpg,美国,2011, 托尼·凯耶 Tony Kaye, 艾德里安·布洛迪 Adrien Brody,8.9,穷尽一生，我们要学会的，不过是彼此拥抱。,剧情,
