id,title ,image_link ,country ,years ,director_description,leader,star ,description,tags,
109,功夫,https://img1.doubanio.com/view/photo/s_ratio_poster/public/p2219011938.jpg,中国大陆 中国香港,2004, 周星驰 Stephen Chow, 周星驰 Stephen Chow,8.7,警恶惩奸，维护世界和平这个任务就交给你了，好吗？,动作/喜剧/犯罪/奇幻,
110,爱在黎明破晓前,https://img9.doubanio.com/view/photo/s_ratio_poster/public/p2555762374.jpg,美国 奥地利 瑞士,1995, 理查德·林克莱特 Richard Linklater, 伊桑·霍克 Ethan Hawke ...,8.8,缘分是个连绵词，最美不过一瞬。,剧情/爱情,
111,小森林 冬春篇,https://img1.doubanio.com/view/photo/s_ratio_poster/public/p2215147728.jpg,日本,2015, 森淳一 Junichi Mori, 桥本爱 Ai Hashimoto,9.0,尊敬他人，尊敬你生活的这片土地，明白孤独是人生的常态。,剧情,
112,入殓师,https://img1.doubanio.com/view/photo/s_ratio_poster/public/p2635433927.jpg,日本,2008, 泷田洋二郎 Yôjirô Takita, 本木雅弘 Masahiro Motoki,8.9,死可能是一道门，逝去并不是终结，而是超越，走向下一程。,剧情,
113,一一,https://img2.doubanio.com/view/photo/s_ratio_poster/public/p2567845803.jpg,中国台湾 日本,2000, 杨德昌 Edward Yang, 吴念真,9.1,我们都曾经是一一。,剧情/爱情/家庭,
114,蝙蝠侠：黑暗骑士崛起,https://img9.doubanio.com/view/photo/s_ratio_poster/public/p1706428744.jpg,美国 英国,2012, 克里斯托弗·诺兰 Christopher Nolan, 克里斯蒂安·贝尔 Christ...,8.8,诺兰就是保证。,剧情/动作/科幻/犯罪/惊悚,
115,消失的爱人,https://img9.doubanio.com/view/photo/s_ratio_poster/public/p2221768894.jpg,美国,2014, 大卫·芬奇 David Fincher, 本·阿弗莱克 Ben Affleck,8.7,年度最佳date movie。,剧情/犯罪/悬疑/惊悚,
116,人生果实,https://img2.doubanio.com/view/photo/s_ratio_poster/public/p2544912792.jpg,日本,2017, 伏原健之 Kenshi Fushihara, 津端修一 Shûichi Tsubata,9.5,土壤没有落叶不会肥沃，没有了你就不算人生。,纪录片,
117,菊次郎的夏天,https://img9.doubanio.com/view/photo/s_ratio_poster/public/p2620392435.jpg,日本,1999, 北野武 Takeshi Kitano, 北野武 Takeshi Kitano,8.8,从没见过那么流氓的温柔，从没见过那么温柔的流氓。,剧情/喜剧,
118,无人知晓,https://img2.doubanio.com/view/photo/s_ratio_poster/public/p661160053.jpg,日本,2004, 是枝裕和 Hirokazu Koreeda, 柳乐优弥 Yûya Yagira,9.1,我的平常生活就是他人的幸福。,剧情,
119,倩女幽魂,https://img9.doubanio.com/view/photo/s_ratio_poster/public/p2414157745.jpg,中国香港,1987, 程小东 Siu-Tung Ching, 张国荣 Leslie Cheung,8.7,两张绝世的脸。 ,爱情/奇幻/武侠/古装,
120,超能陆战队,https://img2.doubanio.com/view/photo/s_ratio_poster/public/p2614500883.jpg,美国,2014, 唐·霍尔 Don Hall, 唐·霍尔 Don Hall,8.7,Balalala~~~,喜剧/动作/科幻/动画/冒险,
121,侧耳倾听,https://img2.doubanio.com/view/photo/s_ratio_poster/public/p456692072.jpg,日本,1995, 近藤喜文 Yoshifumi Kondo, 本名阳子 Youko Honna,8.9,少女情怀总是诗。,剧情/爱情/动画,
122,哈利·波特与阿兹卡班的囚徒,https://img1.doubanio.com/view/photo/s_ratio_poster/public/p1910812549.jpg,英国 美国,2004, Alfonso Cuarón, 丹尼尔·雷德克里夫 Daniel Radcliffe,8.8,不一样的导演，不一样的哈利·波特。,奇幻/冒险,
123,甜蜜蜜,https://img9.doubanio.com/view/photo/s_ratio_poster/public/p2223011274.jpg,中国香港,1996, 陈可辛 Peter Chan, 黎明 Leon Lai,8.9,相逢只要一瞬间，等待却像是一辈子。,剧情/爱情,
124,借东西的小人阿莉埃蒂,https://img9.doubanio.com/view/photo/s_ratio_poster/public/p617533616.jpg,日本,2010, 米林宏昌 Hiromasa Yonebayashi, 志田未来 Mirai Shida,8.8,曾经的那段美好会沉淀为一辈子的记忆。,动画/奇幻/冒险,
125,完美的世界,https://img1.doubanio.com/view/photo/s_ratio_poster/public/p2190556408.jpg,美国,1993, 克林特·伊斯特伍德 Clint Eastwood, 凯文·科斯特纳 Kevin Cos...,9.1,坏人的好总是比好人的好来得更感人。,剧情/犯罪,
126,萤火之森,https://img2.doubanio.com/view/photo/s_ratio_poster/public/p1675053073.jpg,日本,2011, 大森贵弘 Takahiro Omori, 佐仓绫音 Ayane Sakura,8.9,触不到的恋人。,剧情/爱情/动画/奇幻,
127,爱在日落黄昏时,https://img1.doubanio.com/view/photo/s_ratio_poster/public/p2561542458.jpg,美国 法国,2004, 理查德·林克莱特 Richard Linklater, 伊桑·霍克 Ethan Hawke ...,8.8,九年后的重逢是世俗和责任的交叠，没了悸动和青涩，沧桑而温暖。,剧情/爱情,
128,驯龙高手,https://img9.doubanio.com/view/photo/s_ratio_poster/public/p2210954024.jpg,美国,2010, 迪恩·德布洛斯 Dean DeBlois, 迪恩·德布洛斯 Dean DeBlois,8.7,和谐的生活离不开摸头与被摸头。,动画/奇幻/冒险,
129,玛丽和马克思,https://img9.doubanio.com/view/photo/s_ratio_poster/public/p488255145.jpg,澳大利亚,2009, 亚当·艾略特 Adam Elliot, 托妮·科莱特 Toni Collette,8.9,你是我最好的朋友，你是我唯一的朋友 。,剧情/喜剧/动画,
130,幸福终点站,https://img1.doubanio.com/view/photo/s_ratio_poster/public/p854757687.jpg,美国,2004, 史蒂文·斯皮尔伯格 Steven Spielberg, 汤姆·汉克斯 Tom Hanks...,8.8,有时候幸福需要等一等。 ,喜剧/剧情/爱情,
131,告白,https://img9.doubanio.com/view/photo/s_ratio_poster/public/p689520756.jpg,日本,2010, 中岛哲也 Tetsuya Nakashima, 松隆子 Takako Matsu,8.7,没有一人完全善，也没有一人完全恶。,剧情/悬疑,
132,大鱼,https://img9.doubanio.com/view/photo/s_ratio_poster/public/p692813374.jpg,美国,2003, 蒂姆·波顿 Tim Burton, 伊万·麦克格雷格 Ewan McGregor,8.8,抱着梦想而活着的人是幸福的，怀抱梦想而死去的人是不朽的。,剧情/家庭/奇幻/冒险,
133,射雕英雄传之东成西就,https://img9.doubanio.com/view/photo/s_ratio_poster/public/p2609063925.jpg,中国香港,1993, 刘镇伟 Jeffrey Lau, 梁朝伟 Tony Leung Chiu Wai,8.7,百看不厌。 ,喜剧/奇幻/武侠/古装,
134,阳光姐妹淘,https://img1.doubanio.com/view/photo/s_ratio_poster/public/p1374786017.jpg,韩国,2011, 姜炯哲 Hyeong-Cheol Kang, 沈恩京 Eun-kyung Shim,8.8,再多各自牛逼的时光，也比不上一起傻逼的岁月。 ,剧情/喜剧,
135,天书奇谭,https://img1.doubanio.com/view/photo/s_ratio_poster/public/p2515539487.jpg,中国大陆,1983(中国大陆), 王树忱 Shuchen Wang, 王树忱 Shuchen Wang,9.2,传奇的年代，醉人的童话。,动画/奇幻,
136,恐怖直播,https://img9.doubanio.com/view/photo/s_ratio_poster/public/p2016930906.jpg,韩国,2013, 金秉祐 Byeong-woo Kim, 河正宇 Jung-woo Ha,8.7,恐怖分子的“秋菊打官司”。,剧情/犯罪/悬疑,
137,怪兽电力公司,https://img1.doubanio.com/view/photo/s_ratio_poster/public/p2513247938.jpg,美国,2001, 彼特·道格特 Pete Docter, 彼特·道格特 Pete Docter,8.7,不要给它起名字，起了名字就有感情了。,儿童/喜剧/动画/奇幻/冒险,
138,哈利·波特与密室,https://img3.doubanio.com/view/photo/s_ratio_poster/public/p1082651990.jpg,美国 英国 德国,2002, Chris Columbus, 丹尼尔·雷德克里夫 Daniel Radcliffe,8.7,魔法的密室之门已打开...,奇幻/冒险,
139,神偷奶爸,https://img1.doubanio.com/view/photo/s_ratio_poster/public/p792776858.jpg,美国 法国,2010, 皮艾尔·柯芬 Pierre Coffin, 皮艾尔·柯芬 Pierre Coffin,8.6,Mr. I Don't Care其实也有Care的时候。,喜剧/动画/冒险,
140,时空恋旅人,https://img9.doubanio.com/view/photo/s_ratio_poster/public/p2070153774.jpg,英国,2013, 理查德·柯蒂斯 Richard Curtis, 多姆纳尔·格里森 Domhnall Gl...,8.8,把每天当作最后一天般珍惜度过，积极拥抱生活，就是幸福。,喜剧/爱情/奇幻,
141,玩具总动员3,https://img1.doubanio.com/view/photo/s_ratio_poster/public/p1283675359.jpg,美国,2010, 李·昂克里奇 Lee Unkrich, 汤姆·汉克斯 Tom Hanks,8.9,跨度十五年的欢乐与泪水。,喜剧/动画/奇幻/冒险,
142,傲慢与偏见,https://img1.doubanio.com/view/photo/s_ratio_poster/public/p2016401659.jpg,法国 英国 美国,2005, 乔·怀特 Joe Wright, 凯拉·奈特莉 Keira Knightley,8.7,爱是摈弃傲慢与偏见之后的曙光。,剧情/爱情,
143,教父3,https://img3.doubanio.com/view/photo/s_ratio_poster/public/p2169664351.jpg,美国,1990, 弗朗西斯·福特·科波拉 Francis Ford Coppola, 阿尔·帕西诺 A...,8.9,任何信念的力量，都无法改变命运。,剧情/犯罪,
144,釜山行,https://img1.doubanio.com/view/photo/s_ratio_poster/public/p2360940399.jpg,韩国,2016, 延尚昊 Sang-ho Yeon, 孔侑 Yoo Gong,8.6,揭露人性的丧尸题材力作。,动作/惊悚/灾难,
145,血战钢锯岭,https://img1.doubanio.com/view/photo/s_ratio_poster/public/p2398141939.jpg,澳大利亚 美国,2016, 梅尔·吉布森 Mel Gibson, 安德鲁·加菲尔德 Andrew Garfield,8.7,优秀的战争片不会美化战场，不会粉饰死亡，不会矮化敌人，不会无视常识，最重要的，不会宣扬战争。,剧情/传记/历史/战争,
146,哪吒闹海,https://img2.doubanio.com/view/photo/s_ratio_poster/public/p2516566783.jpg,中国大陆,1979, 严定宪 Dingxian Yan, 严定宪 Dingxian Yan,9.1,想你时你在闹海。,冒险/动画/奇幻,
147,一个叫欧维的男人决定去死,https://img2.doubanio.com/view/photo/s_ratio_poster/public/p2406624993.jpg,瑞典,2015, 汉内斯·赫尔姆 Hannes Holm, 罗夫·拉斯加德 Rolf Lassgård...,8.9,惠及一生的美丽。,剧情,
148,被解救的姜戈,https://img1.doubanio.com/view/photo/s_ratio_poster/public/p1800813767.jpg,美国,2012, 昆汀·塔伦蒂诺 Quentin Tarantino, 杰米·福克斯 Jamie Foxx,8.8,热血沸腾，那个低俗、性感的无耻混蛋又来了。,剧情/动作/西部/冒险,
149,七武士,https://img9.doubanio.com/view/photo/s_ratio_poster/public/p2215886505.jpg,日本,1954, 黑泽明 Akira Kurosawa, 三船敏郎 Toshirô Mifune,9.3,时代悲歌。,动作/冒险/剧情,
150,喜宴,https://img1.doubanio.com/view/photo/s_ratio_poster/public/p2249048907.jpg,中国台湾 美国,1993, 李安 Ang Lee, 赵文瑄 Winston Chao,8.9,中国家庭的喜怒哀乐忍。,剧情/喜剧/爱情/同性/家庭,
151,电锯惊魂,https://img9.doubanio.com/view/photo/s_ratio_poster/public/p2565332644.jpg,美国,2004, 詹姆斯·温 James Wan, 雷·沃纳尔 Leigh Whannell,8.7,真相就在眼前。,悬疑/惊悚/恐怖,
152,头号玩家,https://img1.doubanio.com/view/photo/s_ratio_poster/public/p2516578307.jpg,美国,2018, 史蒂文·斯皮尔伯格 Steven Spielberg, 泰伊·谢里丹 Tye Sheri...,8.7,写给影迷，动漫迷和游戏迷的一封情书。,动作/科幻/冒险,
153,我是山姆,https://img9.doubanio.com/view/photo/s_ratio_poster/public/p652417775.jpg,美国,2001, 杰茜·尼尔森 Jessie Nelson, Sean Penn,8.9,爱并不需要智商 。,剧情/家庭,
154,风之谷,https://img2.doubanio.com/view/photo/s_ratio_poster/public/p1917567652.jpg,日本,1984, 宫崎骏 Hayao Miyazaki, 岛本须美 Sumi Shimamoto,8.9,动画片的圣经。,动画/奇幻/冒险,
155,未麻的部屋,https://img2.doubanio.com/view/photo/s_ratio_poster/public/p1351050722.jpg,日本,1997, 今敏 Satoshi Kon, 岩男润子 Junko Iwao,9.0,好的剧本是，就算你猜到了结局也猜不到全部。,动画/奇幻/惊悚,
156,英雄本色,https://img1.doubanio.com/view/photo/s_ratio_poster/public/p2504997087.jpg,中国香港,1986, 吴宇森 John Woo, 周润发 Yun-Fat Chow,8.7,英雄泪短，兄弟情长。 ,剧情/动作/犯罪,
157,上帝之城,https://img3.doubanio.com/view/photo/s_ratio_poster/public/p455677490.jpg,巴西 法国,2002, 费尔南多·梅里尔斯 Fernando Meirelles, 费尔南多·梅里尔斯 Fernando Meirelles,9.0,被上帝抛弃了的上帝之城。,犯罪/剧情,
158,疯狂原始人,https://img1.doubanio.com/view/photo/s_ratio_poster/public/p1867084027.jpg,美国,2013, 科克·德·米科 Kirk De Micco, 科克·德·米科 Kirk De Micco,8.7,老少皆宜，这就是好莱坞动画的魅力。,喜剧/动画/冒险,
159,谍影重重3,https://img1.doubanio.com/view/photo/s_ratio_poster/public/p792223507.jpg,美国 德国,2007, 保罗·格林格拉斯 Paul Greengrass, 马特·达蒙 Matt Damon,8.8,像吃了苏打饼一样干脆的电影。,动作/悬疑/惊悚,
160,卢旺达饭店,https://img2.doubanio.com/view/photo/s_ratio_poster/public/p470419493.jpg,英国 南非 意大利,2004, 特瑞·乔治 Terry George, 唐·钱德尔 Don Cheadle,8.9,当这个世界闭上双眼，他却敞开了怀抱。,剧情/传记/历史/战争,
161,三块广告牌,https://img1.doubanio.com/view/photo/s_ratio_poster/public/p2510081688.jpg,美国 英国,2017, 马丁·麦克唐纳 Martin McDonagh, 弗兰西斯·麦克多蒙德 France...,8.7,怼天怼地，你走后，她与世界为敌。,剧情/犯罪,
162,纵横四海,https://img1.doubanio.com/view/photo/s_ratio_poster/public/p2597918718.jpg,中国香港,1991, 吴宇森 John Woo, 周润发 Yun-Fat Chow,8.8,香港浪漫主义警匪动作片的巅峰之作。,剧情/喜剧/动作/犯罪,
163,花样年华,https://img9.doubanio.com/view/photo/s_ratio_poster/public/p1910828286.jpg,中国香港,2000, 王家卫 Kar Wai Wong, 梁朝伟 Tony Leung Chiu Wai,8.7,偷情本没有这样美。,剧情/爱情,
164,新世界,https://img1.doubanio.com/view/photo/s_ratio_poster/public/p1903379979.jpg,韩国,2013, 朴勋政 Hoon-jung Park, 李政宰 Jung-Jae Lee,8.9,要做就做得狠一点，这样才能活下去。,剧情/犯罪,
165,模仿游戏,https://img2.doubanio.com/view/photo/s_ratio_poster/public/p2255040492.jpg,英国 美国,2014, 莫滕·泰杜姆 Morten Tyldum, 本尼迪克特·康伯巴奇 Benedict C...,8.7,他给机器起名“克里斯托弗”，因为这是他初恋的名字。,剧情/传记/战争/同性,
166,达拉斯买家俱乐部,https://img1.doubanio.com/view/photo/s_ratio_poster/public/p2166160837.jpg,美国,2013, 让-马克·瓦雷 Jean-Marc Vallée, 马修·麦康纳 Matthew McCon...,8.8,Jared Leto的腿比女人还美！,剧情/传记/同性,
167,岁月神偷,https://img3.doubanio.com/view/photo/s_ratio_poster/public/p456666151.jpg,中国香港 中国大陆,2010, 罗启锐 Alex Law, 吴君如 Sandra Ng,8.7,岁月流逝，来日可追。,剧情/家庭,
168,黑客帝国3：矩阵革命,https://img1.doubanio.com/view/photo/s_ratio_poster/public/p443461818.jpg,美国 澳大利亚,2003, Andy Wachowski, Andy Wachowski,8.8,不得不说，《黑客帝国》系列是商业片与科幻、哲学完美结合的典范。,动作/科幻,
169,心迷宫,https://img9.doubanio.com/view/photo/s_ratio_poster/public/p2276780256.jpg,中国大陆,2014, 忻钰坤 Yukun Xin, 霍卫民 Weimin Huo,8.7,荒诞讽刺，千奇百巧，抽丝剥茧，百转千回。,剧情/犯罪/悬疑,
170,头脑特工队,https://img9.doubanio.com/view/photo/s_ratio_poster/public/p2266293606.jpg,美国,2015, 彼特·道格特 Pete Docter, 彼特·道格特 Pete Docter,8.7,愿我们都不用长大，每一座城堡都能永远存在。,喜剧/动画/冒险,
171,记忆碎片,https://img2.doubanio.com/view/photo/s_ratio_poster/public/p641688453.jpg,美国,2000, 克里斯托弗·诺兰 Christopher Nolan, 盖·皮尔斯 Guy Pearce,8.7,一个针管引发的血案。,犯罪/剧情/悬疑/惊悚,
172,你的名字。,https://img1.doubanio.com/view/photo/s_ratio_poster/public/p2395733377.jpg,日本,2016, 新海诚 Makoto Shinkai, 神木隆之介 Ryûnosuke Kamiki,8.4,穿越错位的时空，仰望陨落的星辰，你没留下你的名字，我却无法忘记那句“我爱你”。,剧情/爱情/动画,
173,忠犬八公物语,https://img2.doubanio.com/view/photo/s_ratio_poster/public/p1576418852.jpg,日本,1987, Seijirô Kôyama, 山本圭 Kei Yamamoto,9.2,养狗三日，便会对你终其一生。,剧情,
174,荒蛮故事,https://img2.doubanio.com/view/photo/s_ratio_poster/public/p2584519452.jpg,阿根廷 西班牙,2014, 达米安·斯兹弗隆 Damián Szifron, 达里奥·葛兰帝内提 Darío...,8.8,始于荒诞，止于更荒诞。,剧情/喜剧/犯罪,
175,真爱至上,https://img3.doubanio.com/view/photo/s_ratio_poster/public/p475600770.jpg,英国 美国 法国,2003, 理查德·柯蒂斯 Richard Curtis, 休·格兰特 Hugh Grant,8.6,爱，是个动词。,喜剧/剧情/爱情,
176,海街日记,https://img1.doubanio.com/view/photo/s_ratio_poster/public/p2603364117.jpg,日本,2015, 是枝裕和 Hirokazu Koreeda, 绫濑遥 Haruka Ayase,8.8,是枝裕和的家庭习作。,剧情/家庭,
177,爆裂鼓手,https://img2.doubanio.com/view/photo/s_ratio_poster/public/p2220776342.jpg,美国,2014, 达米恩·查泽雷 Damien Chazelle, 迈尔斯·特勒 Miles Teller,8.7,这个世界从不善待努力的人，努力了也不一定会成功，但是知道自己在努力，就是活下去的动力。,剧情/音乐,
178,贫民窟的百万富翁,https://img3.doubanio.com/view/photo/s_ratio_poster/public/p2434249040.jpg,英国,2008, 丹尼·鲍尔 Danny Boyle, 丹尼·鲍尔 Danny Boyle,8.6,上帝之城+猜火车+阿甘正传+开心辞典=山寨富翁,剧情/爱情,
179,东邪西毒,https://img2.doubanio.com/view/photo/s_ratio_poster/public/p1982176012.jpg,中国香港 中国台湾,1994, 王家卫 Kar Wai Wong, 张国荣 Leslie Cheung,8.6,电影诗。,剧情/动作/爱情/武侠/古装,
180,萤火虫之墓,https://img1.doubanio.com/view/photo/s_ratio_poster/public/p2237136718.jpg,日本,1988, 高畑勋 Isao Takahata, 辰己努,8.7,幸福是生生不息，却难以触及的远。 ,动画/剧情/战争,
181,寄生虫,https://img3.doubanio.com/view/photo/s_ratio_poster/public/p2561439800.jpg,韩国,2019, 奉俊昊 Joon-ho Bong, 宋康昊 Kang-ho Song,8.8,,剧情/喜剧,
182,惊魂记,https://img9.doubanio.com/view/photo/s_ratio_poster/public/p1021883305.jpg,美国,1960, 阿尔弗雷德·希区柯克 Alfred Hitchcock, 安东尼·博金斯 Antho...,9.0,故事的反转与反转，分裂电影的始祖。,悬疑/惊悚/恐怖,
183,黑天鹅,https://img9.doubanio.com/view/photo/s_ratio_poster/public/p2549648344.jpg,美国,2010, 达伦·阿罗诺夫斯基 Darren Aronofsky, 娜塔莉·波特曼 Natalie...,8.6,黑暗之美。,剧情/惊悚,
184,哈利·波特与火焰杯,https://img9.doubanio.com/view/photo/s_ratio_poster/public/p735391084.jpg,英国 美国,2005, 迈克·内威尔 Mike Newell, 丹尼尔·雷德克里夫 Daniel Radclif...,8.6,,悬疑/奇幻/冒险,
185,无敌破坏王,https://img9.doubanio.com/view/photo/s_ratio_poster/public/p1735642656.jpg,美国,2012, 瑞奇·莫尔 Rich Moore, 约翰·C·赖利 John C. Reilly,8.7,迪士尼和皮克斯拿错剧本的产物。,喜剧/动画/奇幻/冒险,
186,你看起来好像很好吃,https://img2.doubanio.com/view/photo/s_ratio_poster/public/p709670262.jpg,日本,2010, 藤森雅也 Masaya Fujimori, 山口胜平 Kappei Yamaguchi,8.9,感情不分食草或者食肉。,剧情/动画/儿童,
187,小偷家族,https://img9.doubanio.com/view/photo/s_ratio_poster/public/p2530599636.jpg,日本,2018, 是枝裕和 Hirokazu Koreeda, 中川雅也 Lily Franky,8.7,我们组成了家。,剧情/犯罪/家庭,
188,绿里奇迹,https://img3.doubanio.com/view/photo/s_ratio_poster/public/p767586451.jpg,美国,1999, Frank Darabont, 汤姆·汉克斯 Tom Hanks,8.9,天使暂时离开。,犯罪/剧情/奇幻/悬疑,
189,冰川时代,https://img1.doubanio.com/view/photo/s_ratio_poster/public/p1910895719.jpg,美国,2002, 卡洛斯·沙尔丹哈 Carlos Saldanha, 卡洛斯·沙尔丹哈 Carlos Saldanha,8.6,松鼠才是角儿。,喜剧/动画/冒险,
190,爱在午夜降临前,https://img1.doubanio.com/view/photo/s_ratio_poster/public/p2074715729.jpg,美国 希腊,2013, 理查德·林克莱特 Richard Linklater, 伊桑·霍克 Ethan Hawke ...,8.8,所谓爱情，就是话唠一路，都不会心生腻烦，彼此嫌弃。,剧情/爱情,
191,雨人,https://img2.doubanio.com/view/photo/s_ratio_poster/public/p2353324612.jpg,美国,1988, 巴瑞·莱文森 Barry Levinson, 达斯汀·霍夫曼 Dustin Hoffman ...,8.7,生活在自己的世界里，也可以让周围的人显得可笑和渺小。,剧情,
192,恋恋笔记本,https://img9.doubanio.com/view/photo/s_ratio_poster/public/p483604864.jpg,美国,2004, 尼克·卡索维茨 Nick Cassavetes, 瑞恩·高斯林 Ryan Gosling,8.5,爱情没有那么多借口，如果不能圆满，只能说明爱的不够。 ,剧情/爱情,
193,疯狂的石头,https://img2.doubanio.com/view/photo/s_ratio_poster/public/p712241453.jpg,中国大陆 中国香港,2006, 宁浩 Hao Ning, 郭涛 Tao Guo,8.5,中国版《两杆大烟枪》。,喜剧/犯罪,
194,九品芝麻官,https://img3.doubanio.com/view/photo/s_ratio_poster/public/p648370300.jpg,中国香港 中国大陆,1994, 王晶 Jing Wong, 周星驰 Stephen Chow,8.6,,剧情/喜剧/古装,
195,恐怖游轮,https://img9.doubanio.com/view/photo/s_ratio_poster/public/p462470694.jpg,英国 澳大利亚,2009, 克里斯托弗·史密斯 Christopher Smith, 梅利莎·乔治 Melissa ...,8.5,不要企图在重复中寻找已经失去的爱。,剧情/悬疑/惊悚,
196,奇迹男孩,https://img1.doubanio.com/view/photo/s_ratio_poster/public/p2507709428.jpg,美国 中国香港,2017, 斯蒂芬·卓博斯基 Stephen Chbosky, 雅各布·特伦布莱 Jacob Tr...,8.6,世界不完美，爱会有奇迹。,剧情/儿童/家庭,
197,雨中曲,https://img9.doubanio.com/view/photo/s_ratio_poster/public/p1612355875.jpg,美国,1952, 斯坦利·多南 Stanley Donen, 斯坦利·多南 Stanley Donen,9.0,骨灰级歌舞片。,喜剧/歌舞/爱情,
198,魔女宅急便,https://img2.doubanio.com/view/photo/s_ratio_poster/public/p456676352.jpg,日本,1989, 宫崎骏 Hayao Miyazaki, 高山南 Minami Takayama,8.7,宫崎骏的电影总让人感觉世界是美好的，阳光明媚的。,动画/奇幻/冒险,
199,二十二,https://img1.doubanio.com/view/photo/s_ratio_poster/public/p2457609817.jpg,中国大陆,2015, 郭柯 Ke Guo,,8.7,有一些东西不应该被遗忘。,纪录片,
200,虎口脱险,https://img2.doubanio.com/view/photo/s_ratio_poster/public/p2399597512.jpg,法国 英国,1966, 杰拉尔·乌里 Gérard Oury, 路易·德·菲耐斯 Louis de Funès...,8.9,永远看不腻的喜剧。,喜剧/战争,
201,海边的曼彻斯特,https://img9.doubanio.com/view/photo/s_ratio_poster/public/p2421855655.jpg,美国,2016, 肯尼斯·罗纳根 Kenneth Lonergan, 卡西·阿弗莱克 Casey Affle...,8.6,我们都有权利不与自己的过去和解。,剧情/家庭,
202,人工智能,https://img1.doubanio.com/view/photo/s_ratio_poster/public/p792257137.jpg,美国 英国,2001, 史蒂文·斯皮尔伯格 Steven Spielberg, 海利·乔·奥斯蒙 Haley...,8.7,对爱的执着，可以超越一切。,剧情/科幻,
203,2001太空漫游,https://img9.doubanio.com/view/photo/s_ratio_poster/public/p2560717825.jpg,英国 美国,1968, 斯坦利·库布里克 Stanley Kubrick, 凯尔·杜拉 Keir Dullea,8.8,现代科幻电影的开山之作，最伟大导演的最伟大影片。,科幻/惊悚/冒险,
204,色，戒,https://img9.doubanio.com/view/photo/s_ratio_poster/public/p453716305.jpg,中国台湾 中国大陆 美国 中国香港,2007, 李安 Ang Lee, 梁朝伟 Tony Leung Chiu Wai,8.5,假戏真情，爱欲深海,剧情/爱情/情色,
205,房间,https://img9.doubanio.com/view/photo/s_ratio_poster/public/p2259715855.jpg,爱尔兰 加拿大 英国 美国,2015, 伦尼·阿伯拉罕森 Lenny Abrahamson, 布丽·拉尔森 Brie Larson...,8.8,被偷走的岁月，被伤害的生命，被禁锢的灵魂，终将被希望和善意救赎。,剧情/家庭,
206,城市之光,https://img1.doubanio.com/view/photo/s_ratio_poster/public/p2170238828.jpg,美国,1931, Charles Chaplin, 查理·卓别林 Charles Chaplin,9.3,永远的小人物，伟大的卓别林。,喜剧/剧情/爱情,
207,可可西里,https://img9.doubanio.com/view/photo/s_ratio_poster/public/p2363208684.jpg,中国大陆 中国香港,2004, 陆川 Chuan Lu, 多布杰 Duobujie,8.8,坚硬的信仰。,剧情/犯罪,
208,罗生门,https://img3.doubanio.com/view/photo/s_ratio_poster/public/p1598883511.jpg,日本,1950, 黑泽明 Akira Kurosawa, 三船敏郎 Toshirô Mifune,8.8,人生的N种可能性。,剧情/犯罪/悬疑,
209,终结者2：审判日,https://img9.doubanio.com/view/photo/s_ratio_poster/public/p1910909085.jpg,美国 法国,1991, 詹姆斯·卡梅隆 James Cameron, 阿诺·施瓦辛格 Arnold Schwarz...,8.7,少见的超越首部的续集，动作片中的经典。,动作/科幻,
210,初恋这件小事,https://img2.doubanio.com/view/photo/s_ratio_poster/public/p1505312273.jpg,泰国,2010, 普特鹏·普罗萨卡·那·萨克那卡林 Puttipong Promsaka Na Sakolnakorn, 普特鹏·普罗萨卡·那·萨克那卡林 Puttipong Promsaka Na Sakolnakorn,8.4,黑小鸭速效美白记。,剧情/喜剧/爱情,
211,大佛普拉斯,https://img2.doubanio.com/view/photo/s_ratio_poster/public/p2505928032.jpg,中国台湾,2017, 黄信尧 Hsin-yao Huang, 庄益增 Yizeng Zhuang,8.7,人们可以登上月球，却永远无法探索人们内心的宇宙。,剧情/喜剧,
212,波西米亚狂想曲,https://img2.doubanio.com/view/photo/s_ratio_poster/public/p2549558913.jpg,英国 美国,2018, 布莱恩·辛格 Bryan Singer, 拉米·马雷克 Rami Malek,8.7,,剧情/传记/同性/音乐,
213,遗愿清单,https://img1.doubanio.com/view/photo/s_ratio_poster/public/p1481879628.jpg,美国,2007, 罗伯·莱纳 Rob Reiner, 杰克·尼科尔森 Jack Nicholson,8.7,用剩余不多的时间，去燃烧整个生命。,冒险/喜剧/剧情,
214,魂断蓝桥,https://img1.doubanio.com/view/photo/s_ratio_poster/public/p2351134499.jpg,美国,1940, 茂文·勒鲁瓦 Mervyn LeRoy, 费雯·丽 Vivien Leigh,8.8,中国式内在的美国电影。,剧情/爱情/战争,
